{
  "$schema": "https://json-schema.org/draft/2020-12/schema",
  "$id": "/schema/theme.schema.json",
  "title": "VIS External Theme",
  "description": "Single external theme definition for VIS theme registry import/export.",
  "type": "object",
  "required": ["id", "label", "regions"],
  "additionalProperties": false,
  "properties": {
    "$schema": {
      "type": "string"
    },
    "version": {
      "type": "integer",
      "const": 1,
      "description": "Theme file format version. Omitted by legacy files; exports use 1."
    },
    "id": {
      "type": "string",
      "pattern": "^[A-Za-z0-9][A-Za-z0-9_-]*$"
    },
    "label": {
      "type": "string",
      "minLength": 1
    },
    "badge": {
      "type": "string"
    },
    "description": {
      "type": "string"
    },
    "swatches": {
      "type": "array",
      "items": {
        "type": "string"
      },
      "maxItems": 4
    },
    "components": {
      "$ref": "#/$defs/themeComponents"
    },
    "floating": {
      "$ref": "#/$defs/floatingTheme"
    },
    "regions": {
      "$ref": "#/$defs/themeRegions"
    }
  },
  "$defs": {
    "regionColors": {
      "type": "object",
      "additionalProperties": false,
      "properties": {
        "bg": { "type": "string" },
        "text": { "type": "string" },
        "border": { "type": "string" },
        "accent": { "type": "string" },
        "controlBg": { "type": "string" },
        "activeBg": { "type": "string" },
        "activeText": { "type": "string" },
        "textMuted": { "type": "string" }
      }
    },
    "themeRegions": {
      "type": "object",
      "required": [
        "topPanel",
        "sidePanel",
        "inputPanel",
        "outputPanel",
        "topDropdown",
        "modalPanel",
        "loginScreen",
        "pageBackground",
        "chatCard"
      ],
      "additionalProperties": false,
      "properties": {
        "topPanel": { "$ref": "#/$defs/regionColors" },
        "sidePanel": { "$ref": "#/$defs/regionColors" },
        "inputPanel": { "$ref": "#/$defs/regionColors" },
        "outputPanel": { "$ref": "#/$defs/regionColors" },
        "topDropdown": { "$ref": "#/$defs/regionColors" },
        "modalPanel": { "$ref": "#/$defs/regionColors" },
        "loginScreen": { "$ref": "#/$defs/regionColors" },
        "pageBackground": { "$ref": "#/$defs/regionColors" },
        "chatCard": { "$ref": "#/$defs/regionColors" }
      }
    },
    "dropdownTheme": {
      "type": "object",
      "additionalProperties": false,
      "properties": {
        "bg": { "type": "string" },
        "border": { "type": "string" },
        "text": { "type": "string" },
        "textMuted": { "type": "string" },
        "controlBg": { "type": "string" },
        "hoverBg": { "type": "string" },
        "activeBg": { "type": "string" },
        "accent": { "type": "string" },
        "shadow": { "type": "string" }
      }
    },
    "chipTheme": {
      "type": "object",
      "additionalProperties": false,
      "properties": {
        "borderNeutral": { "type": "string" },
        "borderSubtle": { "type": "string" },
        "bgNeutral": { "type": "string" },
        "bgHover": { "type": "string" },
        "fgNeutral": { "type": "string" }
      }
    },
    "iconActionTheme": {
      "type": "object",
      "additionalProperties": false,
      "properties": {
        "border": { "type": "string" },
        "bg": { "type": "string" },
        "bgHover": { "type": "string" }
      }
    },
    "dockTheme": {
      "type": "object",
      "additionalProperties": false,
      "properties": {
        "trayBg": { "type": "string" },
        "trayBorder": { "type": "string" },
        "trayShadow": { "type": "string" },
        "thumb": { "type": "string" },
        "chipBg": { "type": "string" },
        "chipHoverBg": { "type": "string" },
        "chipBorder": { "type": "string" },
        "chipText": { "type": "string" },
        "handle": { "type": "string" },
        "handleHover": { "type": "string" },
        "handleShadow": { "type": "string" }
      }
    },
    "formControlTheme": {
      "type": "object",
      "additionalProperties": false,
      "properties": {
        "bg": { "type": "string" },
        "border": { "type": "string" },
        "text": { "type": "string" },
        "placeholder": { "type": "string" },
        "focusBorder": { "type": "string" },
        "focusRing": { "type": "string" },
        "buttonBg": { "type": "string" },
        "buttonBorder": { "type": "string" },
        "buttonText": { "type": "string" },
        "buttonHoverBg": { "type": "string" },
        "buttonPrimaryBg": { "type": "string" },
        "buttonPrimaryBorder": { "type": "string" },
        "buttonPrimaryText": { "type": "string" },
        "buttonPrimaryHoverBg": { "type": "string" }
      }
    },
    "tabTheme": {
      "type": "object",
      "additionalProperties": false,
      "properties": {
        "bg": { "type": "string" },
        "border": { "type": "string" },
        "text": { "type": "string" },
        "hoverBg": { "type": "string" },
        "activeBg": { "type": "string" },
        "activeBorder": { "type": "string" },
        "activeText": { "type": "string" }
      }
    },
    "badgeTheme": {
      "type": "object",
      "additionalProperties": false,
      "properties": {
        "bg": { "type": "string" },
        "border": { "type": "string" },
        "text": { "type": "string" },
        "accentBg": { "type": "string" },
        "accentBorder": { "type": "string" },
        "accentText": { "type": "string" }
      }
    },
    "cardTheme": {
      "type": "object",
      "additionalProperties": false,
      "properties": {
        "bg": { "type": "string" },
        "border": { "type": "string" },
        "shadow": { "type": "string" },
        "hoverBg": { "type": "string" },
        "activeBg": { "type": "string" }
      }
    },
    "toggleTheme": {
      "type": "object",
      "additionalProperties": false,
      "properties": {
        "track": { "type": "string" },
        "trackBorder": { "type": "string" },
        "thumb": { "type": "string" },
        "activeTrack": { "type": "string" },
        "activeThumb": { "type": "string" }
      }
    },
    "listRowTheme": {
      "type": "object",
      "additionalProperties": false,
      "properties": {
        "bg": { "type": "string" },
        "border": { "type": "string" },
        "text": { "type": "string" },
        "textMuted": { "type": "string" },
        "hoverBg": { "type": "string" },
        "activeBg": { "type": "string" }
      }
    },
    "emptyStateTheme": {
      "type": "object",
      "additionalProperties": false,
      "properties": {
        "bg": { "type": "string" },
        "text": { "type": "string" },
        "textMuted": { "type": "string" },
        "icon": { "type": "string" }
      }
    },
    "actionButtonTheme": {
      "type": "object",
      "additionalProperties": false,
      "properties": {
        "bg": { "type": "string" },
        "border": { "type": "string" },
        "text": { "type": "string" },
        "hoverBg": { "type": "string" },
        "accentBg": { "type": "string" },
        "accentBorder": { "type": "string" },
        "accentText": { "type": "string" }
      }
    },
    "searchTheme": {
      "type": "object",
      "additionalProperties": false,
      "properties": {
        "bg": { "type": "string" },
        "border": { "type": "string" },
        "text": { "type": "string" },
        "placeholder": { "type": "string" },
        "icon": { "type": "string" },
        "focusBg": { "type": "string" }
      }
    },
    "floatingWindowTypeTheme": {
      "type": "object",
      "additionalProperties": false,
        "properties": {
          "accent": { "type": "string" },
          "backgroundColor": { "type": "string" },
          "text": { "type": "string" },
          "textMuted": { "type": "string" },
          "textSoft": { "type": "string" },
          "textSecondary": { "type": "string" },
          "syntaxText": { "type": "string" },
          "opacity": { "type": "string" },
          "titlebarOpacity": { "type": "string" },
          "backgroundImage": { "type": "string" }
      }
    },
    "floatingTheme": {
      "type": "object",
      "additionalProperties": false,
      "properties": {
        "surfaceBase": { "type": "string" },
        "surfaceMuted": { "type": "string" },
        "surfaceSubtle": { "type": "string" },
        "surfaceStrong": { "type": "string" },
        "borderMuted": { "type": "string" },
        "borderSubtle": { "type": "string" },
        "borderFaint": { "type": "string" },
        "borderFaintStrong": { "type": "string" },
        "fillFaint": { "type": "string" },
        "text": { "type": "string" },
        "textMuted": { "type": "string" },
        "textSoft": { "type": "string" },
        "textSecondary": { "type": "string" },
        "syntaxText": { "type": "string" },
        "opacity": { "type": "string" },
        "titlebarOpacity": { "type": "string" },
        "backgroundImage": { "type": "string" },
        "default": { "$ref": "#/$defs/floatingWindowTypeTheme" },
        "shell": { "$ref": "#/$defs/floatingWindowTypeTheme" },
        "reasoning": { "$ref": "#/$defs/floatingWindowTypeTheme" },
        "subagent": { "$ref": "#/$defs/floatingWindowTypeTheme" },
        "tool": { "$ref": "#/$defs/floatingWindowTypeTheme" },
        "file": { "$ref": "#/$defs/floatingWindowTypeTheme" },
        "diff": { "$ref": "#/$defs/floatingWindowTypeTheme" },
        "media": { "$ref": "#/$defs/floatingWindowTypeTheme" },
        "dialog": { "$ref": "#/$defs/floatingWindowTypeTheme" },
        "history": { "$ref": "#/$defs/floatingWindowTypeTheme" },
        "debug": { "$ref": "#/$defs/floatingWindowTypeTheme" }
      }
    },
    "themeComponents": {
      "type": "object",
      "additionalProperties": false,
      "properties": {
        "dropdown": { "$ref": "#/$defs/dropdownTheme" },
        "chip": { "$ref": "#/$defs/chipTheme" },
        "iconAction": { "$ref": "#/$defs/iconActionTheme" },
        "dock": { "$ref": "#/$defs/dockTheme" },
        "formControl": { "$ref": "#/$defs/formControlTheme" },
        "tab": { "$ref": "#/$defs/tabTheme" },
        "badge": { "$ref": "#/$defs/badgeTheme" },
        "card": { "$ref": "#/$defs/cardTheme" },
        "toggle": { "$ref": "#/$defs/toggleTheme" },
        "listRow": { "$ref": "#/$defs/listRowTheme" },
        "emptyState": { "$ref": "#/$defs/emptyStateTheme" },
        "actionButton": { "$ref": "#/$defs/actionButtonTheme" },
        "search": { "$ref": "#/$defs/searchTheme" }
      }
    }
  }
}
